{
  "summary": "Illustrative fixture only.",
  "classification": "Specialised AI agent",
  "necessity_verdict": "keep",
  "justification": "Illustrative fixture only: a deterministic process was considered and rejected.",
  "evidence": [
    {
      "source_id": "EV-0001",
      "source_type": "repository_document",
      "title": "HANDOFF.md (illustrative)",
      "location": "HANDOFF.md, Decision model",
      "authority_level": "authoritative_internal",
      "extracted_fact": "Agents propose; the Data Steward evaluates; the appropriate human owner approves.",
      "direct_or_inferred": "direct",
      "timestamp": "2026-10-27T00:00:00Z"
    }
  ],
  "assumptions": [],
  "open_questions": [],
  "recommendations": [],
  "human_action_required": [],
  "handoff": {
    "case_id": "CASE-0001",
    "request": "Illustrative fixture only.",
    "agent": "Stewardship Agent Architect",
    "status": "completed",
    "findings": [
      "n/a"
    ],
    "evidence": [
      {
        "source_id": "EV-0001",
        "source_type": "repository_document",
        "title": "HANDOFF.md (illustrative)",
        "location": "HANDOFF.md, Decision model",
        "authority_level": "authoritative_internal",
        "extracted_fact": "Agents propose; the Data Steward evaluates; the appropriate human owner approves.",
        "direct_or_inferred": "direct",
        "timestamp": "2026-10-27T00:00:00Z"
      }
    ],
    "claims": [
      {
        "claim_id": "CL-0001",
        "statement": "Illustrative fixture only: the agent has no approval authority.",
        "claim_type": "authoritative_internal",
        "confidence": "Supported",
        "evidence_ids": [
          "EV-0001"
        ]
      }
    ],
    "assumptions": [],
    "open_questions": [],
    "human_action_required": [],
    "next_agent": null
  }
}
